{
  "$schema": "https://json-schema.org/draft/2020-12/schema",
  "$id": "https://ccjtkalamazoo.org/kyr/schema/chapter.schema.json",
  "title": "Know Your Rights chapter",
  "description": "One chapter: at least 30 questions. See docs/CONTENT.md for the authoring rules behind these constraints.",
  "type": "object",
  "required": [
    "chapterId",
    "districtId",
    "name",
    "questions"
  ],
  "additionalProperties": false,
  "properties": {
    "chapterId": {
      "type": "string",
      "pattern": "^[a-z]+\\.[0-9]{2}$",
      "description": "district slug + zero-padded chapter number, e.g. stop.03"
    },
    "districtId": {
      "type": "string",
      "pattern": "^[a-z]+$"
    },
    "name": {
      "type": "string",
      "minLength": 2,
      "maxLength": 40,
      "description": "Display name, e.g. AM I FREE TO GO"
    },
    "safetyNote": {
      "type": "string",
      "minLength": 40,
      "maxLength": 400,
      "not": {
        "pattern": "\\u2014"
      },
      "description": "Shown once on the screen before a round starts, not on every question. Chapter specific: the risk of using a right on a sidewalk is different from the risk at school."
    },
    "reviewedBy": {
      "type": [
        "string",
        "null"
      ],
      "description": "Attorney who cleared this chapter. Null until reviewed. A chapter cannot ship with this null."
    },
    "reviewedAt": {
      "type": [
        "string",
        "null"
      ],
      "format": "date",
      "description": "YYYY-MM-DD"
    },
    "questions": {
      "type": "array",
      "minItems": 30,
      "description": "At least 30. A larger pool is fine and dealing only part of it is acceptable. The game deals 15 at random.",
      "items": {
        "$ref": "#/$defs/question"
      }
    }
  },
  "$defs": {
    "question": {
      "type": "object",
      "required": [
        "id",
        "version",
        "q",
        "options",
        "hint",
        "principle",
        "keyPhrase"
      ],
      "additionalProperties": false,
      "properties": {
        "id": {
          "type": "string",
          "pattern": "^[a-z]+\\.[0-9]{2}\\.[0-9]{3}$",
          "description": "Permanent once a chapter has gathered data. While a chapter is still being authored and has never collected a response, cut questions may be removed and the rest renumbered so ids stay contiguous."
        },
        "version": {
          "type": "integer",
          "minimum": 1,
          "description": "Increment on any edit to question or option text."
        },
        "q": {
          "type": "string",
          "minLength": 10,
          "maxLength": 220,
          "not": {
            "pattern": "\\u2014"
          },
          "description": "The question. Must read like something a person would ask out loud. No passive or abstract framings such as 'how is that treated' or 'what is that sentence'. Carries its own situation, since the shuffle means any question can be a player's first. No em dashes."
        },
        "options": {
          "type": "array",
          "minItems": 4,
          "maxItems": 4,
          "description": "Exactly four. Index 0 is ALWAYS the correct answer; the game shuffles display order. All four share a shape and a rough length so the correct one is not guessable, and wrong answers are worded in parallel with the correct one rather than restructured. Every option must answer the question the stem actually asks, read alone.",
          "items": {
            "$ref": "#/$defs/option"
          }
        },
        "hint": {
          "type": "string",
          "minLength": 10,
          "maxLength": 260,
          "not": {
            "pattern": "\\u2014"
          },
          "description": "What COUNSEL shows. Points at the reasoning, not the answer."
        },
        "principle": {
          "type": "string",
          "minLength": 40,
          "maxLength": 700,
          "not": {
            "pattern": "\\u2014"
          },
          "description": "Card 1, THE LAW. The law in plain language. States how something works. Does not tell the player what to choose. Definitions and roles are taught here, at the question where they first matter."
        },
        "safetyNote": {
          "type": "string",
          "minLength": 40,
          "maxLength": 400,
          "not": {
            "pattern": "\\u2014"
          },
          "description": "Optional and normally unused, since safety notes are chapter level. Available where knowing a right and safely using it can come apart."
        },
        "keyPhrase": {
          "type": "object",
          "required": [
            "quote",
            "gloss"
          ],
          "additionalProperties": false,
          "description": "Card 2, REMEMBER THIS. The one thing worth carrying out of this question. May be words a person could say, or a plain statement of the thing to remember, whichever fits the question. Never phrased as an instruction to the player.",
          "properties": {
            "quote": {
              "type": "string",
              "minLength": 4,
              "maxLength": 120,
              "not": {
                "pattern": "\\u2014"
              },
              "description": "The thing to remember. Renders as the centrepiece of card 2: large display type, capped around 16 characters per line, with no quotation marks added by the UI. So a plain fact reads correctly here, not just a spoken line. Can be a sentence someone might say (\"I want a lawyer\") or a plain fact (\"You can always say no\"). Keep it short: long entries wrap badly at that size. Not an instruction."
            },
            "gloss": {
              "type": "string",
              "minLength": 4,
              "maxLength": 160,
              "not": {
                "pattern": "\\u2014"
              },
              "description": "One line expanding the quote. States how something works rather than what to do."
            }
          }
        },
        "scenario": {
          "type": "object",
          "required": [
            "setup",
            "lines"
          ],
          "additionalProperties": false,
          "description": "RETIRED 2026-09-17. This was card 3, IN REAL LIFE, which was removed from the game. Optional and not shown anywhere. Existing entries may stay until they are cleaned out, but do not write new ones.",
          "properties": {
            "setup": {
              "type": "string",
              "minLength": 15,
              "maxLength": 220,
              "not": {
                "pattern": "\\u2014"
              },
              "description": "A concrete situation. Specific beats abstract. One sentence."
            },
            "lines": {
              "type": "array",
              "minItems": 2,
              "maxItems": 7,
              "description": "Speaker lines, at least two.",
              "items": {
                "$ref": "#/$defs/scenarioLine"
              }
            },
            "note": {
              "type": "string",
              "minLength": 10,
              "maxLength": 240,
              "not": {
                "pattern": "\\u2014"
              },
              "description": "Optional footnote."
            }
          }
        },
        "retired": {
          "type": "boolean",
          "default": false,
          "description": "Retired questions keep their ID forever so analytics stay interpretable."
        },
        "setting": {
          "type": "string",
          "enum": [
            "street",
            "school",
            "home",
            "vehicle",
            "phone",
            "facility",
            "store",
            "work",
            "online"
          ],
          "description": "Optional. Where the question takes place. Lets the auditor check that a chapter spreads across settings instead of over pulling toward interrogation rooms."
        },
        "questionType": {
          "type": "string",
          "enum": [
            "standard",
            "line",
            "your_words",
            "who_is_doing_it",
            "judging_a_claim",
            "afterward"
          ],
          "description": "Optional. Which kind of question this is, for the authoring quota: standard (the standard), line (the line), your_words (your words), who_is_doing_it (who is doing it), judging_a_claim (judging a claim), afterward. Lets the auditor check the spread across a chapter, and lets analytics compare performance across question kinds."
        }
      }
    },
    "scenarioLine": {
      "type": "object",
      "required": [
        "label",
        "text"
      ],
      "additionalProperties": false,
      "description": "Part of the retired scenario field. Kept only so existing entries still validate.",
      "properties": {
        "label": {
          "type": "string",
          "maxLength": 20
        },
        "text": {
          "type": "string",
          "minLength": 3,
          "maxLength": 160,
          "not": {
            "pattern": "\\u2014"
          }
        }
      }
    },
    "option": {
      "type": "object",
      "required": [
        "id",
        "text",
        "isCorrect"
      ],
      "additionalProperties": false,
      "properties": {
        "id": {
          "type": "string",
          "pattern": "^[a-z]+\\.[0-9]{2}\\.[0-9]{3}\\.[a-d]$",
          "description": "Question id + a-d. Assigned at authoring time and never moved; display order is shuffled at runtime, so position is meaningless for analytics."
        },
        "text": {
          "type": "string",
          "minLength": 1,
          "maxLength": 180,
          "not": {
            "pattern": "\\u2014"
          },
          "description": "Short. A word or a short phrase beats a sentence. The correct option states how something works, never what the player should choose."
        },
        "isCorrect": {
          "type": "boolean"
        },
        "explanation": {
          "type": [
            "string",
            "null"
          ],
          "maxLength": 500,
          "description": "Null for the correct option, required for every wrong one. This is where most of the teaching happens. A wrong option must be FACTUALLY wrong, so this explains what is untrue about it. An option is never wrong merely because the player talked or answered."
        },
        "misconceptionCode": {
          "type": [
            "string",
            "null"
          ],
          "pattern": "^[a-z][a-z0-9_]*$",
          "description": "Names the false belief this distractor tests. Null for the correct option, required for every wrong one. Must exist in misconceptions.json. Reuse across questions is expected and capped at 10 uses."
        }
      },
      "allOf": [
        {
          "if": {
            "properties": {
              "isCorrect": {
                "const": false
              }
            }
          },
          "then": {
            "required": [
              "explanation",
              "misconceptionCode"
            ],
            "properties": {
              "explanation": {
                "type": "string",
                "minLength": 15,
                "not": {
                  "pattern": "\\u2014"
                }
              },
              "misconceptionCode": {
                "type": "string",
                "minLength": 3
              }
            }
          }
        },
        {
          "if": {
            "properties": {
              "isCorrect": {
                "const": true
              }
            }
          },
          "then": {
            "properties": {
              "explanation": {
                "type": "null"
              },
              "misconceptionCode": {
                "type": "null"
              }
            }
          }
        }
      ]
    }
  }
}
