{
  "chapterId": "court.01",
  "districtId": "court",
  "name": "THE JUDGE, THE JURY, AND THE LAWYERS",
  "safetyNote": "Nothing here is legal advice, and nothing here tells you what to do. It tells you who does what in a courtroom. Six of these questions say \"in Michigan\" because those rules are Michigan's own choice and other states do it differently. The rest are the same everywhere in the country.",
  "reviewedBy": "CCJT legal review",
  "reviewedAt": "2026-09-02",
  "questions": [
    {
      "id": "court.01.001",
      "version": 2,
      "q": "A jury in Michigan just found your uncle guilty. Who decides how long your uncle goes to jail?",
      "options": [
        {
          "id": "court.01.001.a",
          "text": "The judge.",
          "isCorrect": true,
          "explanation": null,
          "misconceptionCode": null
        },
        {
          "id": "court.01.001.b",
          "text": "The jury.",
          "isCorrect": false,
          "explanation": "The jury's job ended when it decided whether the person on trial did it. Picking the punishment is a separate job at a separate hearing.",
          "misconceptionCode": "jury_sets_the_sentence"
        },
        {
          "id": "court.01.001.c",
          "text": "The prosecutor.",
          "isCorrect": false,
          "explanation": "The prosecutor can ask for a sentence. Asking for one and deciding it are two different things.",
          "misconceptionCode": "prosecutor_sets_the_sentence"
        },
        {
          "id": "court.01.001.d",
          "text": "The two lawyers together.",
          "isCorrect": false,
          "explanation": "The two sides can agree on what to ask for. The judge still decides what the sentence actually is.",
          "misconceptionCode": "sentence_is_negotiated_by_lawyers"
        }
      ],
      "hint": "The jury is done. Somebody else does the next part.",
      "principle": "In Michigan the judge picks the sentence. The jury does not. Six states let a jury do it, and Texas is one. Michigan is not.",
      "keyPhrase": {
        "quote": "The jury says whether. The judge says how long.",
        "gloss": "Two jobs, two people."
      },
      "scenario": {
        "setup": "Your neighbor's trial finished this morning. The jury said guilty. His family is in the hallway.",
        "lines": [
          {
            "label": "NEIGHBOR",
            "text": "So that's it? It's over?"
          },
          {
            "label": "YOU",
            "text": "No. The judge does the sentence at a separate hearing."
          },
          {
            "label": "YES",
            "text": "The family is in the room on the day it actually gets decided."
          },
          {
            "label": "NO",
            "text": "Everybody goes home thinking it is finished, and nobody turns up."
          }
        ]
      },
      "setting": "facility",
      "questionType": "standard"
    },
    {
      "id": "court.01.002",
      "version": 2,
      "q": "You are on a jury and the room cannot agree on what the law means. What are jurors supposed to do?",
      "options": [
        {
          "id": "court.01.002.a",
          "text": "Send the judge a written question.",
          "isCorrect": true,
          "explanation": null,
          "misconceptionCode": null
        },
        {
          "id": "court.01.002.b",
          "text": "Go with whichever lawyer explained it better.",
          "isCorrect": false,
          "explanation": "Lawyers argue. What a lawyer says about the law is an argument, not the rule the jury has to follow.",
          "misconceptionCode": "lawyers_instruct_the_jury"
        },
        {
          "id": "court.01.002.c",
          "text": "Vote on what the room thinks it means.",
          "isCorrect": false,
          "explanation": "A jury applies the law to the facts. Deciding what the law means is not the jury's job.",
          "misconceptionCode": "jury_interprets_the_law"
        },
        {
          "id": "court.01.002.d",
          "text": "Ask the bailiff to explain it.",
          "isCorrect": false,
          "explanation": "A bailiff can carry the jury's note to the judge. Explaining the law is not a bailiff's job.",
          "misconceptionCode": "bailiff_explains_the_law"
        }
      ],
      "hint": "Only one person in the building is allowed to answer that.",
      "principle": "The judge hands the jury written instructions. Those explain the law. Jurors decide what happened. The judge decides what the law is. A stuck jury sends the judge a note.",
      "keyPhrase": {
        "quote": "Jurors decide facts, not law.",
        "gloss": "A stuck jury asks the judge, in writing."
      },
      "scenario": {
        "setup": "Your aunt is on a jury and the room cannot agree what the law means.",
        "lines": [
          {
            "label": "AUNT",
            "text": "Half of them think it means one thing, half the other."
          },
          {
            "label": "YOU",
            "text": "Can't you just ask the judge?"
          },
          {
            "label": "YES",
            "text": "A written question goes out and the same answer comes back to everybody."
          },
          {
            "label": "NO",
            "text": "The room settles it themselves and the verdict rests on a guess about the law."
          }
        ]
      },
      "setting": "facility",
      "questionType": "standard"
    },
    {
      "id": "court.01.003",
      "version": 2,
      "q": "You are watching a case from the seats and there is no jury in the room. What is a trial like that called?",
      "options": [
        {
          "id": "court.01.003.a",
          "text": "A bench trial.",
          "isCorrect": true,
          "explanation": null,
          "misconceptionCode": null
        },
        {
          "id": "court.01.003.b",
          "text": "A hearing, not a trial.",
          "isCorrect": false,
          "explanation": "A trial without a jury is a real trial with a real verdict. No jury is coming.",
          "misconceptionCode": "no_jury_no_trial"
        },
        {
          "id": "court.01.003.c",
          "text": "A preliminary trial.",
          "isCorrect": false,
          "explanation": "A trial with no jury is the real trial, not a practice round before one.",
          "misconceptionCode": "real_trials_are_elsewhere"
        },
        {
          "id": "court.01.003.d",
          "text": "A closed trial.",
          "isCorrect": false,
          "explanation": "A trial with no jury is still open to the public. No jury does not mean closed doors.",
          "misconceptionCode": "no_jury_means_closed"
        }
      ],
      "hint": "The judge is sitting on something called the bench.",
      "principle": "A trial with no jury is called a bench trial. The judge does both jobs. The judge decides what happened, and what the law is. Most cases never reach a trial at all.",
      "keyPhrase": {
        "quote": "No jury means the judge does both jobs.",
        "gloss": "It is called a bench trial."
      },
      "scenario": {
        "setup": "Back row of a courtroom with your mom. There is no jury.",
        "lines": [
          {
            "label": "YOU",
            "text": "Where's the jury? I thought there'd be twelve people."
          },
          {
            "label": "MOM",
            "text": "There isn't one. The man on trial picked a bench trial, so the judge decides it."
          },
          {
            "label": "YES",
            "text": "You stay and follow it through to the verdict."
          },
          {
            "label": "NO",
            "text": "You go looking for the real trial and miss the end of this one."
          }
        ]
      },
      "setting": "facility",
      "questionType": "standard"
    },
    {
      "id": "court.01.004",
      "version": 2,
      "q": "A shoplifting charge against you in Michigan is going to trial with a jury. Which of these does the jury decide?",
      "options": [
        {
          "id": "court.01.004.a",
          "text": "Whether you did it.",
          "isCorrect": true,
          "explanation": null,
          "misconceptionCode": null
        },
        {
          "id": "court.01.004.b",
          "text": "How long you go to jail.",
          "isCorrect": false,
          "explanation": "In Michigan the judge sets the sentence at a separate hearing after the verdict.",
          "misconceptionCode": "jury_sets_the_sentence"
        },
        {
          "id": "court.01.004.c",
          "text": "What the law means.",
          "isCorrect": false,
          "explanation": "The judge gives the jury the law in writing. The jury applies it.",
          "misconceptionCode": "jury_interprets_the_law"
        },
        {
          "id": "court.01.004.d",
          "text": "Whether the charge was fair.",
          "isCorrect": false,
          "explanation": "A jury does not review the decision to charge. That was made long before by the prosecutor.",
          "misconceptionCode": "jury_reviews_the_charge"
        }
      ],
      "hint": "A jury answers one question, and it is a question about facts.",
      "principle": "A jury decides one thing. Was the case proved. Not the sentence. Not what the law means. In Michigan a felony jury has 12 people. A misdemeanor jury has 6.",
      "keyPhrase": {
        "quote": "One question, and it is about facts.",
        "gloss": "Did it happen, and did this person do it."
      },
      "scenario": {
        "setup": "A jury summons came in the post for your uncle.",
        "lines": [
          {
            "label": "UNCLE",
            "text": "I'm not deciding how long somebody goes away for. I'll get out of it."
          },
          {
            "label": "YOU",
            "text": "That part isn't yours. The judge does that."
          },
          {
            "label": "YES",